[
  {
    "name": "all_country",
    "scope": ["any"],
    "args": {},
    "since": "1.0",
    "desc": "Checks if all countries meet the triggers."
  },
  {
    "name": "any_country",
    "scope": ["any"],
    "args": {},
    "since": "1.0",
    "desc": "Checks if any country meets the triggers."
  },
  {
    "name": "all_other_country",
    "scope": ["country"],
    "args": {},
    "since": "1.0",
    "desc": "Checks if all countries other than the one where this scope is located meet the triggers."
  },
  {
    "name": "any_other_country",
    "scope": ["country"],
    "args": {},
    "since": "1.0",
    "desc": "Checks if any country other than the one where this scope is located meets the triggers."
  },
  {
    "name": "all_country_with_original_tag",
    "scope": ["any"],
    "args": {
      "original_tag_to_check": "tag"
    },
    "since": "1.9",
    "desc": "Checks if all countries originating from the specified country, including the dynamic countries created for civil wars and other purposes, meet the triggers."
  },
  {
    "name": "any_country_with_original_tag",
    "scope": ["any"],
    "args": {
      "original_tag_to_check": "tag"
    },
    "since": "1.9",
    "desc": "Checks if any country originating from the specified country, including the dynamic countries created for civil wars and other purposes, meet the triggers."
  },
  {
    "name": "all_neighbor_country",
    "scope": ["country"],
    "args": {},
    "since": "1.0",
    "desc": "Checks if all countries that border the one where this scope is located meet the triggers."
  },
  {
    "name": "any_neighbor_country",
    "scope": ["country"],
    "args": {},
    "since": "1.0",
    "desc": "Checks if any country that borders the one where this scope is located meets the triggers."
  },
  {
    "name": "any_home_area_neighbor_country",
    "scope": ["country"],
    "args": {},
    "since": "1.0",
    "desc": "Checks if any country that borders the one where this scope is located, as well as being in its home area - meaning a direct land connection between the capitals of countries - meets the triggers."
  },
  {
    "name": "all_guaranteed_country",
    "scope": ["country"],
    "args": {},
    "since": "1.9",
    "desc": "Checks if all countries that are guaranteed by the one where this scope is located meet the triggers."
  },
  {
    "name": "any_guaranteed_country",
    "scope": ["country"],
    "args": {},
    "since": "1.9",
    "desc": "Checks if any country that is guaranteed by the one where this scope is located meets the triggers."
  },
  {
    "name": "all_allied_country",
    "scope": ["country"],
    "args": {},
    "since": "1.9",
    "desc": "Checks if all countries that are allied with the one where this scope is located meet the triggers. Does not include the country itself."
  },
  {
    "name": "any_allied_country",
    "scope": ["country"],
    "args": {},
    "since": "1.9",
    "desc": "Checks if any country that is allied with the one where this scope is located meet the triggers. Does not include the country itself."
  },
  {
    "name": "all_occupied_country",
    "scope": ["country"],
    "args": {},
    "since": "1.9",
    "desc": "Checks if all countries that are occupied by the one where this scope is located meet the triggers."
  },
  {
    "name": "any_occupied_country",
    "scope": ["country"],
    "args": {},
    "since": "1.9",
    "desc": "Checks if any country that is occupied by the one where this scope is located meet the triggers."
  },
  {
    "name": "all_enemy_country",
    "scope": ["country"],
    "args": {},
    "since": "1.9",
    "desc": "Checks if all countries that are at war with the one where this scope is located meet the triggers."
  },
  {
    "name": "any_enemy_country",
    "scope": ["country"],
    "args": {},
    "since": "1.9",
    "desc": "Checks if any country that are at war with the one where this scope is located meets the triggers."
  },
  {
    "name": "all_subject_countries",
    "scope": ["country"],
    "args": {},
    "since": "1.11",
    "desc": "Checks if all countries that are a subject of the one where this scope is located meet the triggers."
  },
  {
    "name": "any_subject_country",
    "scope": ["country"],
    "args": {},
    "since": "1.11",
    "desc": "Checks if any country that is a subject of the one where this scope is located meets the triggers."
  },
  {
    "name": "any_country_with_core",
    "scope": ["state"],
    "args": {},
    "since": "1.12",
    "desc": "Checks if any country that has the current scope as a core state meets the triggers."
  },
  {
    "name": "all_state",
    "scope": ["any"],
    "args": {},
    "since": "1.0",
    "desc": "Check if all states meet the triggers."
  },
  {
    "name": "any_state",
    "scope": ["any"],
    "args": {},
    "since": "1.0",
    "desc": "Check if any state meets the triggers."
  },
  {
    "name": "any_state_in",
    "scope": ["any"],
    "args": {
      "array": "array_of_states",
      "continent": "string",
      "ai_area": "string",
      "strategic_region": "integer"
    },
    "since": "1.15",
    "desc": "Check if any state in the given category meets the trigger."
  },
  {
    "name": "all_neighbor_state",
    "scope": ["state"],
    "args": {},
    "since": "1.0",
    "desc": "Check if all states that are neighbour to the one where this scope is located meet the triggers."
  },
  {
    "name": "any_neighbor_state",
    "scope": ["state"],
    "args": {},
    "since": "1.0",
    "desc": "Check if any state that is neighbour to the one where this scope is located meets the triggers."
  },
  {
    "name": "all_owned_state",
    "scope": ["country"],
    "args": {},
    "since": "1.0",
    "desc": "Check if all states that are owned by the country where this scope is located meet the triggers."
  },
  {
    "name": "any_owned_state",
    "scope": ["country"],
    "args": {},
    "since": "1.0",
    "desc": "Check if any state that is owned by the country where this scope is located meets the triggers."
  },
  {
    "name": "all_core_state",
    "scope": ["country"],
    "args": {},
    "since": "1.11",
    "desc": "Check if all states that are cored by the country where this scope is located meet the triggers."
  },
  {
    "name": "any_core_state",
    "scope": ["country"],
    "args": {},
    "since": "1.11",
    "desc": "Check if any state that is cored by the country where this scope is located meets the triggers."
  },
  {
    "name": "all_controlled_state",
    "scope": ["country"],
    "args": {},
    "since": "1.9",
    "desc": "Check if all states that are controlled by the country where this scope is located meet the triggers."
  },
  {
    "name": "any_controlled_state",
    "scope": ["country"],
    "args": {},
    "since": "1.9",
    "desc": "Check if any state that is controlled by the country where this scope is located meets the triggers."
  },
  {
    "name": "all_unit_leader",
    "scope": ["country"],
    "args": {},
    "since": "1.5",
    "desc": "Checks if all unit leaders (corps commanders, field marshals, admirals) that are employed by the country where this scope is located meet the triggers."
  },
  {
    "name": "any_unit_leader",
    "scope": ["country"],
    "args": {},
    "since": "1.5",
    "desc": "Checks if any unit leader (corps commander, field marshal, admiral) that is employed by the country where this scope is located meets the triggers."
  },
  {
    "name": "all_army_leader",
    "scope": ["country"],
    "args": {},
    "since": "1.5",
    "desc": "Checks if all army leaders that are employed by the country where this scope is located meet the triggers."
  },
  {
    "name": "any_army_leader",
    "scope": ["country"],
    "args": {},
    "since": "1.5",
    "desc": "Checks if any army leader that is employed by the country where this scope is located meets the triggers."
  },
  {
    "name": "all_navy_leader",
    "scope": ["country"],
    "args": {},
    "since": "1.5",
    "desc": "Checks if all navy leaders that are employed by the country where this scope is located meet the triggers."
  },
  {
    "name": "any_navy_leader",
    "scope": ["country"],
    "args": {},
    "since": "1.5",
    "desc": "Checks if any navy leader that is employed by the country where this scope is located meets the triggers."
  },
  {
    "name": "all_operative_leader",
    "scope": ["country", "operation"],
    "args": {},
    "since": "1.9",
    "desc": "Checks if all operatives that are employed by the country where this scope is located meet the triggers."
  },
  {
    "name": "any_operative_leader",
    "scope": ["country", "operation"],
    "args": {},
    "since": "1.9",
    "desc": "Checks if any operative that is employed by the country where this scope is located meets the triggers."
  },
  {
    "name": "all_character",
    "scope": ["country"],
    "args": {},
    "since": "1.11",
    "desc": "Checks if all characters that are recruited by the country where this scope is located meet the triggers."
  },
  {
    "name": "any_character",
    "scope": ["country"],
    "args": {},
    "since": "1.11",
    "desc": "Checks if any character that is recruited by the country where this scope is located meets the triggers."
  },
  {
    "name": "any_country_division",
    "scope": ["country"],
    "args": {},
    "since": "1.12",
    "desc": "Checks if any division owned by the current country meets the triggers."
  },
  {
    "name": "any_state_division",
    "scope": ["state"],
    "args": {},
    "since": "1.12",
    "desc": "Checks if any division within the current state meets the triggers."
  },
  {
    "name": "all_military_industrial_organization",
    "scope": ["country"],
    "args": {},
    "since": "1.13",
    "desc": "Checks if all MIOs within the current country meet the conditions."
  },
  {
    "name": "any_military_industrial_organization",
    "scope": ["country"],
    "args": {},
    "since": "1.13",